tre/moe_down_reduce_v2/configs/E=512,N=128,device_name=NVIDIA_H20,dtype=fp8_w8a8,block_shape=[128,128].json
{
    "32000": {
        "BLOCK_SIZE_M": 64,
        "BLOCK_SIZE_N": 128,
        "BLOCK_SIZE_K": 128,
        "GROUP_SIZE_M": 16,
        "num_warps": 4,
        "num_stages": 3,
        "UP": {
            "BLOCK_SIZE_M": 64,
            "BLOCK_SIZE_N": 128,
            "BLOCK_SIZE_K": 128,
            "GROUP_SIZE_M": 16,
            "num_warps": 4,
            "num_stages": 3
        },
        "DOWN": {
            "BLOCK_SIZE_M": 64,
            "BLOCK_SIZE_N": 128,
            "BLOCK_SIZE_K": 128,
            "GROUP_SIZE_M": 8,
            "num_warps": 4,
            "num_stages": 2
        }
    }
}
